{
  "schema_version": "8dionysus_codex_plane_trust_state_v1",
  "trust_state_id": "cptrust-2026-04-11T210400Z-root-srv",
  "workspace_root": "/srv/AbyssOS",
  "detected_project_root": "/srv/AbyssOS",
  "project_root_markers_expected": [
    "AOA_WORKSPACE_ROOT",
    ".git"
  ],
  "project_root_marker_match": [
    "AOA_WORKSPACE_ROOT"
  ],
  "project_config_active": true,
  "active_config_layers": [
    "/srv/AbyssOS/.codex/config.toml"
  ],
  "hooks_enabled": true,
  "hook_layers_detected": [
    "/srv/AbyssOS/.codex/hooks.json"
  ],
  "mcp_server_names_expected": [
    "aoa_workspace",
    "aoa_stats",
    "aoa_memo",
    "aoa_session_memory",
    "aoa_evals",
    "aoa_decisions",
    "abyss_machine"
  ],
  "mcp_server_names_detected": [
    "aoa_workspace",
    "aoa_stats",
    "aoa_memo",
    "aoa_session_memory",
    "aoa_evals",
    "aoa_decisions",
    "abyss_machine"
  ],
  "stable_names_ok": true,
  "trust_posture": "trusted_ready",
  "warnings": [],
  "captured_at": "2026-04-11T21:04:00Z"
}
